{
  "$schema": "./installations.schema.json",
  "version": "1.0.0",
  "lastUpdated": "2026-01-17",
  "description": "US Military Installation Database for MilMap",
  "sources": [
    "OpenStreetMap",
    "Public DoD Installation Data"
  ],
  "installations": [
    {
      "id": "fort-liberty",
      "name": "Fort Liberty",
      "aliases": ["Fort Bragg", "Ft Liberty", "Ft Bragg"],
      "type": "fort",
      "branch": "Army",
      "state": "NC",
      "boundingBox": {
        "minLat": 35.0500,
        "maxLat": 35.2200,
        "minLon": -79.1500,
        "maxLon": -78.8500
      }
    },
    {
      "id": "fort-campbell",
      "name": "Fort Campbell",
      "aliases": ["Ft Campbell"],
      "type": "fort",
      "branch": "Army",
      "state": "KY",
      "boundingBox": {
        "minLat": 36.5500,
        "maxLat": 36.7200,
        "minLon": -87.6000,
        "maxLon": -87.3500
      }
    },
    {
      "id": "fort-hood",
      "name": "Fort Cavazos",
      "aliases": ["Fort Hood", "Ft Hood", "Ft Cavazos"],
      "type": "fort",
      "branch": "Army",
      "state": "TX",
      "boundingBox": {
        "minLat": 31.0500,
        "maxLat": 31.3500,
        "minLon": -97.9000,
        "maxLon": -97.6000
      }
    },
    {
      "id": "fort-benning",
      "name": "Fort Moore",
      "aliases": ["Fort Benning", "Ft Benning", "Ft Moore"],
      "type": "fort",
      "branch": "Army",
      "state": "GA",
      "boundingBox": {
        "minLat": 32.2800,
        "maxLat": 32.4800,
        "minLon": -85.0500,
        "maxLon": -84.7500
      }
    },
    {
      "id": "fort-stewart",
      "name": "Fort Stewart",
      "aliases": ["Ft Stewart"],
      "type": "fort",
      "branch": "Army",
      "state": "GA",
      "boundingBox": {
        "minLat": 31.7500,
        "maxLat": 32.0500,
        "minLon": -81.7500,
        "maxLon": -81.3500
      }
    },
    {
      "id": "fort-drum",
      "name": "Fort Drum",
      "aliases": ["Ft Drum"],
      "type": "fort",
      "branch": "Army",
      "state": "NY",
      "boundingBox": {
        "minLat": 43.9500,
        "maxLat": 44.1500,
        "minLon": -75.9000,
        "maxLon": -75.6000
      }
    },
    {
      "id": "fort-carson",
      "name": "Fort Carson",
      "aliases": ["Ft Carson"],
      "type": "fort",
      "branch": "Army",
      "state": "CO",
      "boundingBox": {
        "minLat": 38.6500,
        "maxLat": 38.8500,
        "minLon": -104.8500,
        "maxLon": -104.6500
      }
    },
    {
      "id": "fort-bliss",
      "name": "Fort Bliss",
      "aliases": ["Ft Bliss"],
      "type": "fort",
      "branch": "Army",
      "state": "TX",
      "boundingBox": {
        "minLat": 31.7500,
        "maxLat": 32.1000,
        "minLon": -106.5000,
        "maxLon": -105.9000
      }
    },
    {
      "id": "fort-sill",
      "name": "Fort Sill",
      "aliases": ["Ft Sill"],
      "type": "fort",
      "branch": "Army",
      "state": "OK",
      "boundingBox": {
        "minLat": 34.6000,
        "maxLat": 34.8000,
        "minLon": -98.5500,
        "maxLon": -98.3000
      }
    },
    {
      "id": "fort-riley",
      "name": "Fort Riley",
      "aliases": ["Ft Riley"],
      "type": "fort",
      "branch": "Army",
      "state": "KS",
      "boundingBox": {
        "minLat": 39.0000,
        "maxLat": 39.2000,
        "minLon": -96.9500,
        "maxLon": -96.6500
      }
    },
    {
      "id": "fort-polk",
      "name": "Fort Johnson",
      "aliases": ["Fort Polk", "Ft Polk", "Ft Johnson", "JRTC"],
      "type": "fort",
      "branch": "Army",
      "state": "LA",
      "boundingBox": {
        "minLat": 31.0000,
        "maxLat": 31.2500,
        "minLon": -93.3000,
        "maxLon": -93.0000
      }
    },
    {
      "id": "fort-irwin",
      "name": "Fort Irwin",
      "aliases": ["Ft Irwin", "NTC", "National Training Center"],
      "type": "fort",
      "branch": "Army",
      "state": "CA",
      "boundingBox": {
        "minLat": 35.1000,
        "maxLat": 35.4500,
        "minLon": -116.8000,
        "maxLon": -116.4000
      }
    },
    {
      "id": "fort-lewis",
      "name": "Joint Base Lewis-McChord",
      "aliases": ["Fort Lewis", "Ft Lewis", "McChord AFB", "JBLM"],
      "type": "joint_base",
      "branch": "Joint",
      "state": "WA",
      "boundingBox": {
        "minLat": 46.9500,
        "maxLat": 47.2000,
        "minLon": -122.6500,
        "maxLon": -122.3500
      }
    },
    {
      "id": "fort-huachuca",
      "name": "Fort Huachuca",
      "aliases": ["Ft Huachuca"],
      "type": "fort",
      "branch": "Army",
      "state": "AZ",
      "boundingBox": {
        "minLat": 31.4500,
        "maxLat": 31.6500,
        "minLon": -110.4500,
        "maxLon": -110.2000
      }
    },
    {
      "id": "fort-gordon",
      "name": "Fort Eisenhower",
      "aliases": ["Fort Gordon", "Ft Gordon", "Ft Eisenhower"],
      "type": "fort",
      "branch": "Army",
      "state": "GA",
      "boundingBox": {
        "minLat": 33.3500,
        "maxLat": 33.5000,
        "minLon": -82.2500,
        "maxLon": -82.0500
      }
    },
    {
      "id": "fort-jackson",
      "name": "Fort Jackson",
      "aliases": ["Ft Jackson"],
      "type": "fort",
      "branch": "Army",
      "state": "SC",
      "boundingBox": {
        "minLat": 33.9500,
        "maxLat": 34.1000,
        "minLon": -80.9500,
        "maxLon": -80.8000
      }
    },
    {
      "id": "fort-leonard-wood",
      "name": "Fort Leonard Wood",
      "aliases": ["Ft Leonard Wood", "FLW"],
      "type": "fort",
      "branch": "Army",
      "state": "MO",
      "boundingBox": {
        "minLat": 37.6500,
        "maxLat": 37.8500,
        "minLon": -92.2500,
        "maxLon": -92.0000
      }
    },
    {
      "id": "fort-leavenworth",
      "name": "Fort Leavenworth",
      "aliases": ["Ft Leavenworth"],
      "type": "fort",
      "branch": "Army",
      "state": "KS",
      "boundingBox": {
        "minLat": 39.3000,
        "maxLat": 39.4000,
        "minLon": -94.9500,
        "maxLon": -94.8500
      }
    },
    {
      "id": "fort-meade",
      "name": "Fort Meade",
      "aliases": ["Ft Meade", "NSA"],
      "type": "fort",
      "branch": "Army",
      "state": "MD",
      "boundingBox": {
        "minLat": 39.0700,
        "maxLat": 39.1500,
        "minLon": -76.7800,
        "maxLon": -76.7000
      }
    },
    {
      "id": "fort-belvoir",
      "name": "Fort Belvoir",
      "aliases": ["Ft Belvoir"],
      "type": "fort",
      "branch": "Army",
      "state": "VA",
      "boundingBox": {
        "minLat": 38.6800,
        "maxLat": 38.7600,
        "minLon": -77.2000,
        "maxLon": -77.0800
      }
    },
    {
      "id": "camp-pendleton",
      "name": "Marine Corps Base Camp Pendleton",
      "aliases": ["Camp Pendleton", "MCB Camp Pendleton"],
      "type": "camp",
      "branch": "Marines",
      "state": "CA",
      "boundingBox": {
        "minLat": 33.1500,
        "maxLat": 33.4500,
        "minLon": -117.5500,
        "maxLon": -117.2500
      }
    },
    {
      "id": "camp-lejeune",
      "name": "Marine Corps Base Camp Lejeune",
      "aliases": ["Camp Lejeune", "MCB Camp Lejeune"],
      "type": "camp",
      "branch": "Marines",
      "state": "NC",
      "boundingBox": {
        "minLat": 34.5500,
        "maxLat": 34.8000,
        "minLon": -77.5500,
        "maxLon": -77.2000
      }
    },
    {
      "id": "mcas-miramar",
      "name": "Marine Corps Air Station Miramar",
      "aliases": ["MCAS Miramar", "Miramar"],
      "type": "air_station",
      "branch": "Marines",
      "state": "CA",
      "boundingBox": {
        "minLat": 32.8500,
        "maxLat": 32.9200,
        "minLon": -117.1700,
        "maxLon": -117.0800
      }
    },
    {
      "id": "mcas-cherry-point",
      "name": "Marine Corps Air Station Cherry Point",
      "aliases": ["MCAS Cherry Point", "Cherry Point"],
      "type": "air_station",
      "branch": "Marines",
      "state": "NC",
      "boundingBox": {
        "minLat": 34.8500,
        "maxLat": 34.9500,
        "minLon": -76.9500,
        "maxLon": -76.8000
      }
    },
    {
      "id": "mcrd-san-diego",
      "name": "Marine Corps Recruit Depot San Diego",
      "aliases": ["MCRD San Diego", "MCRD SD"],
      "type": "depot",
      "branch": "Marines",
      "state": "CA",
      "boundingBox": {
        "minLat": 32.7350,
        "maxLat": 32.7500,
        "minLon": -117.2050,
        "maxLon": -117.1850
      }
    },
    {
      "id": "mcrd-parris-island",
      "name": "Marine Corps Recruit Depot Parris Island",
      "aliases": ["MCRD Parris Island", "Parris Island"],
      "type": "depot",
      "branch": "Marines",
      "state": "SC",
      "boundingBox": {
        "minLat": 32.3200,
        "maxLat": 32.3700,
        "minLon": -80.7200,
        "maxLon": -80.6500
      }
    },
    {
      "id": "twentynine-palms",
      "name": "Marine Corps Air Ground Combat Center Twentynine Palms",
      "aliases": ["Twentynine Palms", "29 Palms", "MCAGCC"],
      "type": "combat_center",
      "branch": "Marines",
      "state": "CA",
      "boundingBox": {
        "minLat": 34.0000,
        "maxLat": 34.5000,
        "minLon": -116.5000,
        "maxLon": -115.5000
      }
    },
    {
      "id": "quantico",
      "name": "Marine Corps Base Quantico",
      "aliases": ["Quantico", "MCB Quantico"],
      "type": "base",
      "branch": "Marines",
      "state": "VA",
      "boundingBox": {
        "minLat": 38.4500,
        "maxLat": 38.6000,
        "minLon": -77.4500,
        "maxLon": -77.2500
      }
    },
    {
      "id": "naval-station-norfolk",
      "name": "Naval Station Norfolk",
      "aliases": ["NS Norfolk", "Norfolk Naval Base"],
      "type": "naval_station",
      "branch": "Navy",
      "state": "VA",
      "boundingBox": {
        "minLat": 36.9200,
        "maxLat": 37.0000,
        "minLon": -76.3500,
        "maxLon": -76.2500
      }
    },
    {